{
  "schema_version": "motion_trace_event.v0",
  "motion_trace_event_id": "mot_trace_rr003_demo_feedback_001",
  "event_id": "evt_rr003_demo_trace_001",
  "motion_event_id": "mot_evt_rr003_demo_user_001",
  "trace_phase": "feedback_evaluated",
  "result_state": "degraded",
  "reported_at": "2026-06-03T09:00:04Z",
  "fallback_used": true,
  "stop_reason": "none",
  "safe_visible_state": "degraded",
  "feedback_evaluation": "minor_mismatch",
  "issue_type": "runtime_issue",
  "bounded_movement_summary": {
    "sample_window_ms": 1200,
    "sample_count": 12,
    "track_summaries": [
      {
        "track": "face",
        "result": "applied",
        "changed": true,
        "summary_bucket": "medium",
        "confidence": 0.9
      },
      {
        "track": "right_hand",
        "result": "degraded",
        "changed": true,
        "summary_bucket": "low",
        "confidence": 0.66
      }
    ]
  },
  "timing": {
    "observed_at": "2026-06-03T09:00:02Z",
    "recorded_at": "2026-06-03T09:00:04Z",
    "valid_from": "2026-06-03T09:00:02Z",
    "valid_until": "2026-06-03T09:00:05Z",
    "stale_after": "2026-06-03T09:00:10Z",
    "source_offset": "journal_rr003_demo_001:42"
  },
  "trace": {
    "event_id": "evt_rr003_demo_trace_001",
    "turn_id": "turn_rr003_demo_001",
    "episode_id": "ep_rr003_demo_001",
    "issue_ticket_id": "issue_rr003_demo_wave_degraded_001",
    "motion_event_id": "mot_evt_rr003_demo_user_001",
    "stimulus_id": "mot_stim_rr003_demo_wave",
    "stimulus_instance_id": "mot_inst_rr003_demo_user_001",
    "selection_id": "mot_sel_rr003_demo_user_001",
    "mixer_tick_id": "mot_tick_rr003_demo_001",
    "driver_result_id": "mot_drv_rr003_demo_001",
    "runtime_result_id": "mot_res_rr003_demo_001",
    "body_schema_snapshot_id": "body_schema_rr003_demo_001"
  },
  "evidence_refs": [
    {
      "evidence_ref_id": "evref_rr003_driver_result_001",
      "source_kind": "driver_result",
      "relation": "supports",
      "ref": "mot_drv_rr003_demo_001",
      "redacted_summary_ref": "summary_rr003_driver_result_001"
    }
  ],
  "redaction": {
    "redaction_status": "summary_only",
    "redaction_profile": "motion_contract_internal_v0",
    "shareability_class": "review_packet",
    "public_safe": false
  },
  "safety": {
    "raw_prompt_shared": false,
    "raw_transcript_shared": false,
    "raw_log_shared": false,
    "raw_media_shared": false,
    "raw_path_shared": false,
    "raw_asset_filename_shared": false,
    "provider_payload_shared": false,
    "private_endpoint_shared": false,
    "home_assistant_route_retained": false
  }
}
